{
  "periodFromDate": "2017-01-25",
  "periodToDate": "2018-01-24",
  "incomes": {
    "turnover": {
      "amount": 500.25
    },
    "other": {
      "amount": 500.25
    }
  },
  "expenses": {
    "costOfGoodsBought": {
      "amount": 500.25,
      "disallowableAmount": 500.25
    },
    "cisPaymentsTo": {
      "amount": 500.25,
      "disallowableAmount": 500.25
    },
    "staffCosts": {
      "amount": 500.25,
      "disallowableAmount": 500.25
    },
    "travelCosts": {
      "amount": 500.25,
      "disallowableAmount": 500.25
    },
    "premisesRunningCosts": {
      "amount": 500.25,
      "disallowableAmount": 500.25
    },
    "maintenanceCosts": {
      "amount": 500.25,
      "disallowableAmount": 500.25
    },
    "adminCosts": {
      "amount": 500.25,
      "disallowableAmount": 500.25
    },
    "advertisingCosts": {
      "amount": 500.25,
      "disallowableAmount": 500.25
    },
    "businessEntertainmentCosts": {
      "amount": 500.25,
      "disallowableAmount": 500.25
    },
    "interestOnLoans": {
      "amount": 500.25,
      "disallowableAmount": 500.25
    },
    "financialCharges": {
      "amount": 500.25,
      "disallowableAmount": 500.25
    },
    "badDebt": {
      "amount": 500.25,
      "disallowableAmount": 500.25
    },
    "professionalFees": {
      "amount": 500.25,
      "disallowableAmount": 500.25
    },
    "depreciation": {
      "amount": 500.25,
      "disallowableAmount": 500.25
    },
    "other": {
      "amount": 500.25,
      "disallowableAmount": 500.25
    }
  }
}